{
  "archive": "example-archive",
  "archiveLogs": true,
  "artifactGC": "example-artifactgc",
  "artifactory": "example-artifactory",
  "azure": "example-azure",
  "deleted": true,
  "from": "example-from",
  "fromExpression": "example-fromexpression",
  "gcs": "example-gcs",
  "git": "example-git",
  "globalName": "my-workflow",
  "hdfs": "example-hdfs",
  "http": "example-http",
  "mode": 26,
  "name": "my-workflow",
  "optional": true,
  "oss": "example-oss",
  "path": "example-path",
  "plugin": "example-plugin",
  "raw": "example-raw",
  "recurseMode": true,
  "s3": "example-s3",
  "subPath": "example-subpath"
}